Heading,Link,Intro,Subheading,Definitions,Example,List_item,table_item,Image_url
jquery||Filtering,https://www.w3schools.com/jquery/jquery_traversing_filtering.asp,,"['The first(), last(), eq(), filter() and not() Methods', 'jQuery first() Method', 'jQuery last() Method', 'jQuery eq() method', 'jQuery filter() Method', 'jQuery not() Method']","['The most basic filtering methods are first(), last() and eq(), which \nallow you to select a specific element based on its position in a group of \nelements. Other filtering methods, like filter() and not() allow you to select elements \nthat match, or do not match, a certain criteria. ', 'The first() method returns the first element of the specified elements.The following example selects the first <div> \nelement:', 'The last() method returns the last element of the specified elements.The following example selects the last <div> \nelement:', 'The eq() method returns an element with a specific index number of the \nselected elements.The index numbers start at 0, so the first element will have the index number \n0 and not 1. The following example selects the second <p> element (index number \n1):', 'The filter() method lets you specify a criteria. Elements that do not match \nthe criteria are removed from the selection, and those that match will be \nreturned.The following example returns all <p> elements with class name ""intro"":', 'The not() method returns all elements that do not match the criteria.Tip: The not() method is the opposite of filter().The following example returns all <p> elements that do not have class name \n""intro"":', 'For a complete overview of all jQuery Traversing methods, please go to our\njQuery Traversing Reference.']","['\n $(document).ready(function(){\xa0\xa0$(""div"").first();}); ', '\n $(document).ready(function(){\xa0\xa0$(""div"").last();}); ', '\n $(document).ready(function(){\xa0 $(""p"").eq(1);}); ', '\n $(document).ready(function(){\xa0 $(""p"").filter("".intro"");}); ', '\n $(document).ready(function(){\xa0\xa0$(""p"").not("".intro"");}); ', '']",[''],[],[]
jquery||AJAX Introduction,https://www.w3schools.com/jquery/jquery_ajax_intro.asp,"AJAX is the art of exchanging data with a server, and updating 
parts of a web page - without reloading the whole page.","['What is AJAX?', 'What About jQuery and AJAX?', 'jQuery AJAX Methods']","['AJAX = Asynchronous JavaScript and XML.In short; AJAX is about loading data in the background and display it on the \nwebpage, without reloading the whole page.Examples of applications using AJAX: Gmail, Google Maps, Youtube, and \nFacebook tabs.You can learn more about AJAX in our AJAX tutorial.\n', 'jQuery provides several methods for AJAX functionality.With the jQuery AJAX methods, you can request text, HTML, XML, or JSON from a remote \nserver using both HTTP Get and HTTP Post - And you can load the external data directly into the selected HTML elements of your \nweb page!', 'In the next chapters we will look at the most important jQuery AJAX methods.']","['\nLet jQuery AJAX Change This Text\nGet External Content\n', '', '']",[''],[],[]
jquery||AJAX load() Method,https://www.w3schools.com/jquery/jquery_ajax_load.asp,,"['jQuery load() Method', 'jQuery AJAX Reference']","['The jQuery load() method is a simple, but powerful AJAX method.The load() method loads data from a \nserver and puts the returned data into the selected element.Syntax:The required URL parameter specifies the URL you wish to load.The optional data parameter specifies a set of querystring key/value pairs to send along with \nthe request.The optional callback parameter is the name of a function to be executed \nafter the load() method is completed.Here is the content of our example file: ""demo_test.txt"":The following example loads the content of the file ""demo_test.txt"" into a \nspecific <div> element:It is also possible to add a jQuery selector to the URL parameter. The following example loads the content of the element with id=""p1"", inside \nthe file ""demo_test.txt"", into a specific <div> element:The optional callback parameter specifies a callback function to run when the \nload() method is completed. The callback function can have different parameters:The following example displays an alert box after the load() method \ncompletes. If the load() method has succeeded, it displays ""External content \nloaded successfully!"", and if it fails it displays an error message:', 'For a complete overview of all jQuery AJAX methods, please go to our jQuery \nAJAX Reference.']","['\n$(""#div1"").load(""demo_test.txt""); &&&&&& \n$(""#div1"").load(""demo_test.txt #p1""); &&&&&& \n$(""button"").click(function(){\n\xa0\xa0$(""#div1"").load(""demo_test.txt"", function(responseTxt, statusTxt, xhr){\n  \xa0\xa0\xa0 if(statusTxt == ""success"")\n  \xa0\xa0\xa0\xa0\xa0 alert(""External content loaded successfully!"");\n  \xa0\xa0\xa0 if(statusTxt == ""error"")\n  \xa0\xa0\xa0\xa0\xa0 alert(""Error: "" + xhr.status + "": "" + xhr.statusText);\n  \xa0 });\n});', '']",['jQuery load() Method###&&&|||responseTxt - contains the resulting content if the call succeeds|||statusTxt - contains the status of the call|||xhr - contains the XMLHttpRequest object|||'],[],[]
jquery||AJAX get() and post() Methods,https://www.w3schools.com/jquery/jquery_ajax_get_post.asp,"The jQuery get() and post() methods are used to request data from the server 
with an HTTP GET 
or POST request.","['HTTP Request: GET vs. POST', 'jQuery $.get() Method', 'jQuery $.post() Method', 'jQuery AJAX Reference']","['Two commonly used methods for a request-response between a client and server \nare: GET and \nPOST.GET is basically used for just getting (retrieving) some data from the server.\nNote: The GET method may return cached data.POST can also be used to get some data from the server. However, the POST \nmethod NEVER caches data, and is often used to send data along with the request.To learn more about GET and POST, and the differences between the two \nmethods, please read our HTTP Methods GET vs \nPOST chapter.', 'The $.get() method requests data from the server with an HTTP GET request.Syntax:The required URL parameter specifies the URL you wish to request.The optional callback parameter is the name of a function to be executed \nif the request succeeds.The following example uses the $.get() method to retrieve data from a file on \nthe server:The first parameter of $.get() is the URL we wish to request (""demo_test.asp"").The second \nparameter is a callback function. The first callback parameter holds the content of \nthe page requested, and the second callback parameter holds the status of \nthe request.Tip: Here is how the ASP file looks like (""demo_test.asp""):', 'The $.post() method requests data from the server using an HTTP POST request.Syntax:The required URL parameter specifies the URL you wish to request.The optional data parameter specifies some data to send along with the \nrequest.The optional callback parameter is the name of a function to be executed \nif the request succeeds.The following example uses the $.post() method to send some data along with the \nrequest:The first parameter of $.post() is the URL we wish to request (""demo_test_post.asp"").Then we pass in some data to send along with the request (name and city).The ASP script in ""demo_test_post.asp"" reads the parameters, \nprocesses them, and returns a result.The third \nparameter is a callback function. The first callback parameter holds the content of \nthe page requested, and the second callback parameter holds the status of \nthe request.Tip: Here is how the ASP file looks like (""demo_test_post.asp""):', 'For a complete overview of all jQuery AJAX methods, please go to our jQuery \nAJAX Reference.']","['\n$(""button"").click(function(){\n  \xa0 $.get(""demo_test.asp"", function(data, status){\n\xa0\xa0\xa0\xa0alert(""Data: "" + data + ""\\nStatus: "" + status);\n\xa0\xa0});\n});', '\n$(""button"").click(function(){\n\xa0\xa0$.post(""demo_test_post.asp"",\n  \xa0\xa0{\n  \xa0\xa0\xa0 name: ""Donald Duck"",\n  \xa0\xa0\xa0 city: ""Duckburg""\n\xa0\xa0},\n\xa0\xa0function(data, status){\n\xa0\xa0\xa0\xa0alert(""Data: "" + data + ""\\nStatus: "" + status);\n  \xa0 });\n});', '', '']",['HTTP Request: GET vs. POST###&&&|||GET - Requests data from a specified resource|||POST - Submits data to be processed to a specified resource|||'],[],[]
jquery||The noConflict() Method,https://www.w3schools.com/jquery/jquery_noconflict.asp,"What if you wish to use other frameworks on your pages, 
while still using jQuery?","['jQuery and Other JavaScript Frameworks', 'The jQuery noConflict() Method', 'jQuery Misc Reference']","['As you already know; jQuery uses the $ sign as a shortcut for jQuery.There are many other popular JavaScript frameworks like: Angular, Backbone, Ember, Knockout, and more.What if other JavaScript frameworks also use the $ sign as a shortcut?If two different frameworks are using the same shortcut, one of them might stop working.The jQuery team have already thought about this, and implemented the noConflict() method.', 'The noConflict() method releases the hold on the $ shortcut identifier, \nso that other scripts can use it.You can of course still use jQuery, simply by \nwriting the full name instead of the shortcut:You can also create your \nown shortcut very easily. The noConflict() method returns a reference to jQuery, \nthat you can save in a variable, for later use. Here is an example:If you have a block of jQuery code which uses the $ shortcut and you do not \nwant to change it all, you can pass the $ sign in as a parameter to the ready method. This allows \nyou to access jQuery using $, inside this function - outside of it, \nyou will have to use ""jQuery"":', 'For a complete overview of all jQuery Misc methods, please go to our\njQuery Misc Reference.']","['\n$.noConflict();\njQuery(document).ready(function(){\n\xa0\xa0jQuery(""button"").click(function(){\n  \xa0\xa0\xa0 jQuery(""p"").text(""jQuery is still working!"");\n\xa0\xa0});\n});\n &&&&&& \nvar jq = $.noConflict();\njq(document).ready(function(){\n\xa0\xa0jq(""button"").click(function(){\n\xa0\xa0\xa0 jq(""p"").text(""jQuery is still working!"");\n\xa0\xa0});\n});\n &&&&&& \n$.noConflict();\njQuery(document).ready(function($){\n  \xa0 $(""button"").click(function(){\n  \xa0\xa0\xa0 $(""p"").text(""jQuery is still working!"");\n\xa0\xa0});\n});\n', '', '']",[''],[],[]
jquery||Filters,https://www.w3schools.com/jquery/jquery_filters.asp,,"['jQuery Filters', 'Filter Tables', 'Filter Lists', 'Filter Anything']","['Use jQuery to filter/search for specific elements.', 'Perform a case-insensitive search for items in a table:Example explained: We use jQuery to loop through each table \nrows to check if there are any text values that matches the value of the input \nfield. The toggle() method hides the row (display:none) that does not match the \nsearch. We use the toLowerCase() DOM method to convert the text to lower case, which \nmakes the search case insensitive (allows ""john"", ""John"", and even ""JOHN"" on \nsearch).', 'Perform a case-insensitive search for items in a list:', 'Perform a case-insensitive search for text inside a div element:']","['\n\nType something in the input field to search the table for first names, last names or emails:\n\n\n\n\n\nFirstname\nLastname\nEmail\n\n\n\n\nJohn\nDoe\njohn@example.com\n\n\nMary\nMoe\nmary@mail.com\n\n\nJuly\nDooley\njuly@greatstuff.com\n\n\nAnja\nRavendale\na_r@test.com\n\n\n\n\n\n$(document).ready(function(){\n  $(""#myInput"").on(""keyup"", function() {\n    var value = $(this).val().toLowerCase();\n    $(""#myTable tr"").filter(function() {\n      $(this).toggle( $(this).text().toLowerCase().indexOf(value) > -1 );\n    });\n  });\n});\n\n', '\n  <script>$(document).ready(function(){\xa0 $(""#myInput"").on(""keyup"", function() {\xa0\xa0\xa0 var \n  value = $(this).val().toLowerCase();\xa0\xa0\xa0 $(""#myTable tr"").filter(function() {\n  \xa0\xa0\xa0\xa0\xa0 $(this).toggle($(this).text().toLowerCase().indexOf(value) > -1)\xa0\xa0\xa0 });\n  \xa0\n  });});</script>', '\n\nType something in the input field to search the list for items:\n\n\n\nFirst item\nSecond item\nThird item\nFourth\n\n\n\n$(document).ready(function(){\n  $(""#myInputList"").on(""keyup"", function() {\n    var value = $(this).val().toLowerCase();\n    $(""#myList li"").filter(function() {\n      $(this).toggle( $(this).text().toLowerCase().indexOf(value) > -1 );\n    });\n  });\n});\n\n', '']",[''],['Firstname|||Lastname|||Email|||&&&John|||Doe|||john@example.com|||&&&Mary|||Moe|||mary@mail.com|||&&&July|||Dooley|||july@greatstuff.com|||&&&Anja|||Ravendale|||a_r@test.com|||&&&'],[]
jquery||Examples,https://www.w3schools.com/jquery/jquery_examples.asp,Do you want to test your jQuery selector skills?,"['jQuery Selectors', 'jQuery Events', 'jQuery Hide/Show', 'jQuery Fade', 'jQuery Slide', 'jQuery Animate', 'jQuery Stop Animations', 'jQuery HTML Get Content and Attributes', 'jQuery HTML Set Content and Attributes', 'jQuery HTML Add Elements/Content', 'jQuery HTML Remove Elements/Content', 'jQuery Get and Set CSS Classes', 'jQuery css() Method', 'jQuery Dimensions', 'jQuery Traversing Ancestors', 'jQuery Traversing Descendants', 'jQuery Traversing Siblings', 'jQuery Traversing Filtering', 'jQuery Filters', 'jQuery AJAX load() Method', 'jQuery AJAX get() and post() Methods']","['Try Our \njQuery Selector Tester', 'Selectors explained', 'Events explained', 'Hide and Show explained', 'Fade explained', 'Slide explained', 'Animate explained', 'Stop Animations explained', 'Get Content and Attributes explained', 'Set Content and Attributes explained', 'Add Elements/Content explained', 'Remove Elements/Content explained', 'Get and Set CSS explained', 'The css() method explained', 'Dimensions explained', 'Traversing Ancestors explained', 'Traversing Descendants explained', 'Traversing Siblings explained', 'Traversing Filtering explained', 'Filters explained', 'AJAX load() explained', 'AJAX get() and post() explained']","['', '', '', '', '', '', '', '', '', '', '', '', '', '', '', '', '', '', '', '', '']",[''],[],[]
jquery||Quiz Test,https://www.w3schools.com/jquery/jquery_quiz.asp,You can test your jQuery skills with W3Schools' Quiz.,"['The Test', 'Count Your Score']","[""The test contains 25 questions and there is no time limit.The test is not official, it's just a nice way to see how much you know, or don't know, about \nthe jQuery library.You will get 1 point for each correct answer. At the end of the Quiz,\nyour total score will be displayed. Maximum score is 25 points."", '']","['', '']",[''],[],[]
jquery||Exercises,https://www.w3schools.com/jquery/jquery_exercises.asp,You can test your jQuery skills with W3Schools' Exercises.,[],"['We have gathered a variety of jQuery exercises (with answers) for each jQuery Chapter.Try to solve an exercise by filling in the missing parts of a code. If you\'re stuck, hit the ""Show Answer"" button to see what you\'ve done wrong.You will get 1 point for\neach correct answer. Your score and total score will always be displayed.']",[],[''],[],[]
jquery||jQuery Certificate,https://www.w3schools.com/jquery/jquery_exam.asp,,['How Does It Work?'],[''],[''],"['How Does It Work?###&&&|||Study for free at W3Schools.com|||Study at your own speed|||Test your skills with W3Schools online quizzes|||Apply for your certificate by paying an exam fee|||Take your exam online, at any time, and from any location|||']","['.cls-1{fill:#04aa6b;}.cls-2{font-size:23px;}.cls-2,.cls-3,.cls-4{fill:#fff;}.cls-2,.cls-3{font-family:RobotoMono-Medium, Roboto Mono;font-weight:500;}.cls-3{font-size:20.08px;}w3schools CERTIFIED  .  2021\n|||\xa0\xa0|||\nW3Schools offers an Online Certification Program.\nThe perfect solution for busy professionals who need to balance work, family, and career building.\nMore than 30 000 certificates already issued!\n|||&&&', '\nDocument Your Skills\nKnowledge is power, especially in the current job market. Documentation of your skills enables you to advance your career, or help you to start a new one.\nGet a Certificate\nGetting a certificate proves your commitment to upgrade your skills,\ngives you the credibility needed for more responsibilities, larger projects, and a higher salary.\n\nGet Your Certificate \n\n|||\n\n|||&&&']",['/cert/pic_html_cert_small.gif']
jquery||,https://www.w3schools.com/jquery/jquery_ref_overview.asp,,['jQuery Reference'],"['\nThis section contains a complete jQuery reference documentation.', 'The jQuery reference contains a list of all jQuery selectors, methods, properties and events, along with examples.']",[''],[''],[],[]
jquery||Selectors,https://www.w3schools.com/jquery/jquery_ref_selectors.asp,,['jQuery Selectors'],['Use our jQuery Selector Tester to demonstrate the different selectors.'],[''],[''],"['Selector|||Example|||Selects|||&&&*|||$(""*"")|||All elements|||&&&#id|||$(""#lastname"")|||The element with id=""lastname""|||&&&.class|||$("".intro"")|||All elements with class=""intro""|||&&&.class,.class|||$("".intro,.demo"")|||All elements with the class ""intro"" or ""demo""|||&&&element|||$(""p"")|||All <p> elements|||&&&el1,el2,el3|||$(""h1,div,p"")|||All <h1>, <div> and <p> elements|||&&&\xa0|||\xa0|||\xa0|||&&&:first|||$(""p:first"")|||The first <p> element|||&&&:last|||$(""p:last"")|||The last <p> element|||&&&:even|||$(""tr:even"")|||All even <tr> elements|||&&&:odd|||$(""tr:odd"")|||All odd <tr> elements|||&&&\xa0|||\xa0|||\xa0|||&&&:first-child|||$(""p:first-child"")|||All <p> elements that are the first child of their parent|||&&&:first-of-type|||$(""p:first-of-type"")|||All <p> elements that are the first <p> element of their parent|||&&&:last-child|||$(""p:last-child"")|||All <p> elements that are the last child of their parent|||&&&:last-of-type|||$(""p:last-of-type"")|||All <p> elements that are the last <p> element of their parent|||&&&:nth-child(n)|||$(""p:nth-child(2)"")|||All <p> elements that are the 2nd child of their parent|||&&&:nth-last-child(n)|||$(""p:nth-last-child(2)"")|||All <p> elements that are the 2nd child of their parent, counting from the \nlast child|||&&&:nth-of-type(n)|||$(""p:nth-of-type(2)"")|||All <p> elements that are the 2nd <p> element of their parent|||&&&:nth-last-of-type(n)|||$(""p:nth-last-of-type(2)"")|||All <p> elements that are the 2nd <p> element of their parent, counting from the \nlast child|||&&&:only-child|||$(""p:only-child"")|||All <p> elements that are the only child of their parent|||&&&:only-of-type|||$(""p:only-of-type"")|||All <p> elements that are the only child, of its type, of their parent|||&&&\xa0|||\xa0|||\xa0|||&&&parent > child|||$(""div > p"")|||All <p> elements that are a direct child of a <div> element|||&&&parent descendant|||$(""div p"")|||All <p> elements that are descendants of a <div> element|||&&&element + next|||$(""div + p"")|||The <p> element that are next to each <div> elements|||&&&element ~ siblings|||$(""div ~ p"")|||All <p> elements that appear after the <div> element|||&&&\xa0|||\xa0|||\xa0|||&&&:eq(index)|||$(""ul li:eq(3)"")|||The fourth element in a list (index starts at 0)|||&&&:gt(no)|||$(""ul li:gt(3)"")|||List elements with an index greater than 3|||&&&:lt(no)|||$(""ul li:lt(3)"")|||List elements with an index less than 3|||&&&:not(selector)|||$(""input:not(:empty)"")|||All input elements that are not empty|||&&&\xa0|||\xa0|||\xa0|||&&&:header|||$("":header"")|||All header elements <h1>, <h2> ...|||&&&:animated|||$("":animated"")|||All animated elements|||&&&:focus|||$("":focus"")|||The element that currently has focus|||&&&:contains(text)|||$("":contains(\'Hello\')"")|||All elements which contains the text ""Hello""|||&&&:has(selector)|||$(""div:has(p)"")|||All <div> elements that have a <p> element|||&&&:empty|||$("":empty"")|||All elements that are empty|||&&&:parent|||$("":parent"")|||All elements that are a parent of another element|||&&&:hidden|||$(""p:hidden"")|||All hidden <p> elements|||&&&:visible|||$(""table:visible"")|||All visible tables|||&&&:root|||$("":root"")|||The document\'s root element|||&&&:lang(language)|||$(""p:lang(de)"")|||All <p> elements with a lang attribute value starting with ""de""|||&&&\xa0|||\xa0|||\xa0|||&&&[attribute]|||$(""[href]"")|||All elements with a href attribute|||&&&[attribute=value]|||$(""[href=\'default.htm\']"")|||All elements with a href attribute value equal to ""default.htm""|||&&&[attribute!=value]|||$(""[href!=\'default.htm\']"")|||All elements with a href attribute value not equal to ""default.htm""|||&&&[attribute$=value]|||$(""[href$=\'.jpg\']"")|||All elements with a href attribute value ending with "".jpg""|||&&&[attribute|=value]|||$(""[title|=\'Tomorrow\']"")|||All elements with a title attribute value equal to \'Tomorrow\', or starting \nwith \'Tomorrow\' followed by a hyphen|||&&&[attribute^=value]|||$(""[title^=\'Tom\']"")|||All elements with a title attribute value starting with ""Tom""|||&&&[attribute~=value]|||$(""[title~=\'hello\']"")|||All elements with a title attribute value containing the specific word ""hello""|||&&&[attribute*=value]|||$(""[title*=\'hello\']"")|||All elements with a title attribute value containing the word ""hello""|||&&&\xa0|||\xa0|||\xa0|||&&&:input|||$("":input"")|||All input elements|||&&&:text|||$("":text"")|||All input elements with type=""text""|||&&&:password|||$("":password"")|||All input elements with type=""password""|||&&&:radio|||$("":radio"")|||All input elements with type=""radio""|||&&&:checkbox|||$("":checkbox"")|||All input elements with type=""checkbox""|||&&&:submit|||$("":submit"")|||All input elements with type=""submit""|||&&&:reset|||$("":reset"")|||All input elements with type=""reset""|||&&&:button|||$("":button"")|||All input elements with type=""button""|||&&&:image|||$("":image"")|||All input elements with type=""image""|||&&&:file|||$("":file"")|||All input elements with type=""file""|||&&&:enabled|||$("":enabled"")|||All enabled input elements|||&&&:disabled|||$("":disabled"")|||All disabled input elements|||&&&:selected|||$("":selected"")|||All selected input elements|||&&&:checked|||$("":checked"")|||All checked input elements|||&&&']",[]
